{
  "schema": "musparql.reviewer-kg-domain-assessment.v1",
  "id": "synthetic-domain-assessment-0001",
  "reviewer_id": "reviewer-0042",
  "kg_id": "synthetic-kg",
  "review_domain_id": "synthetic-music-domain",
  "review_domain_label": "Synthetic music domain",
  "subject_expertise_level": "advanced",
  "assessed_at": "2026-01-02T10:00:00Z",
  "context": "pre_review",
  "assignment_id": "synthetic-assignment-0001",
  "seed_version": "synthetic-seed-v1",
  "previous_assessment_id": null
}
